{
  "schema_version": 1,
  "operation_id": "55555555-5555-4555-8555-555555555555",
  "idempotency_key": "66666666-6666-4666-8666-666666666666",
  "attempt_id": "77777777-7777-4777-8777-777777777777",
  "workspace_id": "33333333-3333-4333-8333-333333333333",
  "project_id": "22222222-2222-4222-8222-222222222222",
  "base_revision_id": "11111111-1111-4111-8111-111111111111",
  "client_id": "88888888-8888-4888-8888-888888888888",
  "client_sequence": 1,
  "kind": "project.metadata.set",
  "payload": {
    "name": "Synthetic training project"
  },
  "payload_sha256": "sha256:dddddddddddddddddddddddddddddddddddddddddddddddddddddddddddddddd",
  "created_at": "2026-08-11T08:05:00Z"
}
